{
  "rationale": "Obsidian QBIT crystal cathedral album cover: 32 STRUCTURAL Fibonacci voxel terrain with VAELRIX glyph monuments, cyan photon halo, gold framing, and 'THE CRYSTAL EXISTS' subtitle. The voxel scene composes the QBIT field at full energy and lets materials self-organize; the card glow ties the crystal to the void palette (cyan #75F7FF rim, gold #F7C948 accents). Token set: voidBlack #05030A, qbitCyan #75F7FF, alchemyGold #F7C948, boneWhite #F4EDE4.",
  "confidence": 0.91,
  "reviewRequired": false,
  "sourceIntentHash": "obsidian-choir-crystal-v1",
  "evalSuiteId": "suite-voxel-album-cover",
  "proposedLayout": {
    "id": "obsidian-choir-cover",
    "type": "container",
    "role": "wrapper",
    "layout": {
      "display": "flex",
      "flexDirection": "column",
      "justifyContent": "center",
      "alignItems": "center",
      "width": "100%",
      "height": "100%",
      "padding": 24
    },
    "style": { "variant": "transparent" },
    "children": [
      {
        "id": "obsidian-choir-card",
        "type": "container",
        "role": "card",
        "layout": {
          "display": "flex",
          "flexDirection": "column",
          "width": 720,
          "height": 720,
          "padding": 0,
          "gap": 0
        },
        "style": {
          "variant": "obsidianPanel",
          "glowColor": "void",
          "borderRadius": 12
        },
        "children": [
          {
            "id": "obsidian-choir-scene",
            "type": "voxel",
            "role": "voxel-scene",
            "layout": { "width": 720, "height": 540 },
            "style": { "variant": "obsidianPanel", "borderRadius": 8 },
            "props": {
              "volumeSize": 32,
              "text": "VAELRIX",
              "seed": {
                "iterations": 6,
                "scale": 0.75,
                "initialEnergy": 0.5,
                "decay": 0.15,
                "propagationIterations": 3,
                "hollowIterations": 3,
                "gravitySteps": 8
              }
            }
          },
          {
            "id": "obsidian-choir-overlay",
            "type": "container",
            "role": "footer",
            "layout": {
              "display": "flex",
              "flexDirection": "column",
              "justifyContent": "center",
              "alignItems": "center",
              "width": "100%",
              "height": 180,
              "padding": 16,
              "gap": 8
            },
            "style": { "variant": "transparent" },
            "children": [
              {
                "id": "obsidian-choir-title",
                "type": "element",
                "role": "text",
                "props": {
                  "title": "VAELRIX",
                  "subtitle": "obsidian QBIT crystal cathedral"
                }
              },
              {
                "id": "obsidian-choir-subtitle",
                "type": "element",
                "role": "badge",
                "style": { "variant": "neonBorder", "glowColor": "void" },
                "props": { "text": "THE CRYSTAL EXISTS" }
              }
            ]
          }
        ]
      }
    ]
  }
}
